[
  {
    "id": "vslstm-dpplstm",
    "name": "vsLSTM / dppLSTM",
    "kind": "implementation",
    "url": "https://github.com/kezhang-cs/Video-Summarization-with-LSTM",
    "provenance": "official",
    "attribution_evidence": "Repository README identifies the method/dataset authors and links the corresponding paper: https://github.com/kezhang-cs/Video-Summarization-with-LSTM/blob/0ee0a0948872544567ecede76868287042470f75/README.md",
    "paper_ids": [
      "lstm-dpp"
    ],
    "framework": "Python 2.7+, Theano 0.7+, MATLAB",
    "version_or_commit": "0ee0a0948872544567ecede76868287042470f75",
    "license": "LICENSE.md states CC-BY without a version; metadata restricted to research purposes; original dataset rights separate.",
    "artifacts": "models/model_trained_SumMe and models/model_trained_TVSum present in GitHub tree; binary weights not downloaded. README data download anchor lacks an actual URL; data/README.md contains extraction instruction only.",
    "feature_schema": "2-fps GoogLeNet pool5; HDF5 idx, fea_i, gt_1_i, gt_2_i schema, not the later video_i/features schema.",
    "evaluation_notes": "Supervised comparator. MATLAB wrapper reports SumMe max-user F1; released evaluate_TVSum.m uses 0.18 for reference budget despite 15% paper convention.",
    "reproducibility": "Repository metadata, default-branch commit, README and listed source files inspected; no upstream environment installed, code executed, model loaded, or paper score reproduced.",
    "limitations": "Legacy Theano/MATLAB environment; advertised data download is incomplete. Do not treat weights in the tree as validated inference.",
    "verified_on": "2026-09-08",
    "sources": [
      "https://github.com/kezhang-cs/Video-Summarization-with-LSTM/blob/0ee0a0948872544567ecede76868287042470f75/README.md",
      "https://github.com/kezhang-cs/Video-Summarization-with-LSTM/blob/0ee0a0948872544567ecede76868287042470f75/LICENSE.md",
      "https://github.com/kezhang-cs/Video-Summarization-with-LSTM/blob/0ee0a0948872544567ecede76868287042470f75/codes/dppLSTM_main.py",
      "https://github.com/kezhang-cs/Video-Summarization-with-LSTM/blob/0ee0a0948872544567ecede76868287042470f75/codes/dppLSTM_eval.m",
      "https://github.com/kezhang-cs/Video-Summarization-with-LSTM/blob/0ee0a0948872544567ecede76868287042470f75/codes/evalTVSum/evaluate_TVSum.m",
      "https://github.com/kezhang-cs/Video-Summarization-with-LSTM/blob/0ee0a0948872544567ecede76868287042470f75/data/README.md"
    ]
  },
  {
    "id": "dr-dsn-code",
    "name": "DR-DSN (PyTorch)",
    "kind": "implementation",
    "url": "https://github.com/KaiyangZhou/pytorch-vsumm-reinforce",
    "provenance": "official",
    "attribution_evidence": "Repository README identifies the method/dataset authors and links the corresponding paper: https://github.com/KaiyangZhou/pytorch-vsumm-reinforce/blob/041606fec8e2ba7f4c4900064a76d965a473e53c/README.md",
    "paper_ids": [
      "dr-dsn"
    ],
    "framework": "Python 2.7; PyTorch 0.4.0",
    "version_or_commit": "041606fec8e2ba7f4c4900064a76d965a473e53c",
    "license": "MIT (GitHub license metadata).",
    "artifacts": "README redirects the inaccessible QMUL dataset server to Google Drive; no pretrained weights advertised. Archive not downloaded. Advertised data: https://drive.google.com/open?id=1Bf0beMN_ieiM3JpprghaoOwQe9QJIyAN .",
    "feature_schema": "GoogLeNet HDF5 video groups: features, change_points, picks, n_frames, n_frame_per_seg, user_summary; gtscore read only when exporting evaluation results in inspected main.py.",
    "evaluation_notes": "Reward-only training in inspected main.py; final max-epoch checkpoint saved. KTS metadata, mean shot values, exact knapsack, floor(0.15*N); SumMe max, TVSum average. create_split.py generates repeated random partitions.",
    "reproducibility": "Repository metadata, default-branch commit, README and listed source files inspected; no upstream environment installed, code executed, model loaded, or paper score reproduced.",
    "limitations": "Old Python/PyTorch APIs; own video requires HDF5 preprocessing and frame filename changes for rendering. Dataset feature owner differs from dataset creators.",
    "verified_on": "2026-09-08",
    "sources": [
      "https://github.com/KaiyangZhou/pytorch-vsumm-reinforce/blob/041606fec8e2ba7f4c4900064a76d965a473e53c/README.md",
      "https://github.com/KaiyangZhou/pytorch-vsumm-reinforce/blob/041606fec8e2ba7f4c4900064a76d965a473e53c/main.py",
      "https://github.com/KaiyangZhou/pytorch-vsumm-reinforce/blob/041606fec8e2ba7f4c4900064a76d965a473e53c/rewards.py",
      "https://github.com/KaiyangZhou/pytorch-vsumm-reinforce/blob/041606fec8e2ba7f4c4900064a76d965a473e53c/vsum_tools.py",
      "https://github.com/KaiyangZhou/pytorch-vsumm-reinforce/blob/041606fec8e2ba7f4c4900064a76d965a473e53c/create_split.py"
    ]
  },
  {
    "id": "sum-gan-community",
    "name": "SUM-GAN community implementation",
    "kind": "implementation",
    "url": "https://github.com/j-min/Adversarial_Video_Summary",
    "provenance": "community",
    "attribution_evidence": "README explicitly identifies an unofficial reimplementation and its code author: https://github.com/j-min/Adversarial_Video_Summary/blob/fb6d5bf70479373f96f2d944c672af8286c9bc89/README.md",
    "paper_ids": [
      "sum-gan"
    ],
    "framework": "PyTorch / torchvision; exact versions not pinned in inspected README or config",
    "version_or_commit": "fb6d5bf70479373f96f2d944c672af8286c9bc89",
    "license": "No repository-wide license file found in inspected tree.",
    "artifacts": "Feature extraction source present; no pretrained summarizer checkpoint or feature archive found in inspected release.",
    "feature_schema": "ResNet-101 or ResNet-152 pool output, 2048 dimensions; README says projection to 500 instead of paper GoogLeNet 1024.",
    "evaluation_notes": "Community architecture/training example; it is not verified reproduction of the CVPR 2017 SUM-GAN score.",
    "reproducibility": "Repository metadata, default-branch commit, README and listed source files inspected; no upstream environment installed, code executed, model loaded, or paper score reproduced.",
    "limitations": "README documents changed backbone, reduced discriminator learning rate, and frozen discriminator updates; no ready end-to-end benchmark evaluator found in inspected tree.",
    "verified_on": "2026-09-08",
    "sources": [
      "https://github.com/j-min/Adversarial_Video_Summary/blob/fb6d5bf70479373f96f2d944c672af8286c9bc89/README.md",
      "https://github.com/j-min/Adversarial_Video_Summary/blob/fb6d5bf70479373f96f2d944c672af8286c9bc89/feature_extraction.py",
      "https://github.com/j-min/Adversarial_Video_Summary/blob/fb6d5bf70479373f96f2d944c672af8286c9bc89/configs.py",
      "https://github.com/j-min/Adversarial_Video_Summary/blob/fb6d5bf70479373f96f2d944c672af8286c9bc89/solver.py"
    ]
  },
  {
    "id": "sum-gan-aae-code",
    "name": "SUM-GAN-AAE",
    "kind": "implementation",
    "url": "https://github.com/e-apostolidis/SUM-GAN-AAE",
    "provenance": "official",
    "attribution_evidence": "Repository README identifies the method/dataset authors and links the corresponding paper: https://github.com/e-apostolidis/SUM-GAN-AAE/blob/3bced18d30f04e74e2189601b30ad5d170758250/README.md",
    "paper_ids": [
      "sum-gan-aae"
    ],
    "framework": "Python 3.6; PyTorch 1.0.1",
    "version_or_commit": "3bced18d30f04e74e2189601b30ad5d170758250",
    "license": "Custom academic, non-commercial license.",
    "artifacts": "SumMe/TVSum HDF5 .rar archives and five JSON splits present in tree; compressed data not downloaded; no pretrained checkpoint found. Source archive directory: https://github.com/e-apostolidis/SUM-GAN-AAE/tree/3bced18d30f04e74e2189601b30ad5d170758250/data .",
    "feature_schema": "features[T,1024], gtscore[T], user_summary[U,N], change_points[S,2], n_frame_per_seg[S], picks[T], n_frames, n_steps, gtsummary[T].",
    "evaluation_notes": "Unsupervised training architecture; separate multi-user and synthesized-reference scripts. Evaluation emits test F1 per epoch; an independent checkpoint-selection rule is required before reporting held-out results.",
    "reproducibility": "Repository metadata, default-branch commit, README and listed source files inspected; no upstream environment installed, code executed, model loaded, or paper score reproduced.",
    "limitations": "Evaluation paths include a hard-coded split directory; README run_splits invocation differs from filename. No audit claim of label-free model selection or successful execution.",
    "verified_on": "2026-09-08",
    "sources": [
      "https://github.com/e-apostolidis/SUM-GAN-AAE/blob/3bced18d30f04e74e2189601b30ad5d170758250/README.md",
      "https://github.com/e-apostolidis/SUM-GAN-AAE/blob/3bced18d30f04e74e2189601b30ad5d170758250/model/data_loader.py",
      "https://github.com/e-apostolidis/SUM-GAN-AAE/blob/3bced18d30f04e74e2189601b30ad5d170758250/evaluation/check_fscores_summe.py",
      "https://github.com/e-apostolidis/SUM-GAN-AAE/blob/3bced18d30f04e74e2189601b30ad5d170758250/evaluation/check_fscores_summe_with_gts.py",
      "https://github.com/e-apostolidis/SUM-GAN-AAE/blob/3bced18d30f04e74e2189601b30ad5d170758250/evaluation/generate_summary.py"
    ]
  },
  {
    "id": "vasnet-code",
    "name": "VASNet",
    "kind": "implementation",
    "url": "https://github.com/ok1zjf/VASNet",
    "provenance": "official",
    "attribution_evidence": "Repository README identifies the method/dataset authors and links the corresponding paper: https://github.com/ok1zjf/VASNet/blob/c3787531486f74789dc5e92758edf51e24f56e6d/README.md",
    "paper_ids": [
      "vasnet"
    ],
    "framework": "Python 3.5.2; PyTorch 0.4.1; NumPy 1.16.1; h5py 2.8.0; OR-Tools 6.9.5824",
    "version_or_commit": "c3787531486f74789dc5e92758edf51e24f56e6d",
    "license": "MIT (GitHub license metadata).",